{"schemaVersion":1,"purpose":"web-initial-render-fallback","epoch":"J2000.0","units":{"ra":"radian","dec":"radian","vMagnitude":"mag","bvColor":"mag"},"columns":["hr","hd","raRad","decRad","vMagnitude","bvColor","catalogName","spectralType"],"selection":{"algorithm":"vMagnitude <= magnitudeLimit || requiredHrs.has(hr)","magnitudeLimit":5,"requiredHrs":[15,21,168,188,264,403,424,472,542,617,936,1017,1457,1708,1713,1790,1791,1852,1903,1948,2004,2061,2088,2294,2326,2491,2618,2693,2891,2943,2990,3307,3685,3748,3982,4057,4295,4301,4357,4534,4554,4656,4660,4730,4763,4853,4905,5054,5056,5191,5267,5340,5563,5953,5984,6134,6217,6241,6508,6527,6553,6879,7001,7106,7121,7178,7417,7525,7528,7557,7602,7790,7796,7924,7949,8425,8728]},"source":{"catalogArtifact":"shared/catalog/bright-stars.v1.json","catalogContentSha256":"d80785e3c05206f2988a0369825a1cad6d0249784246c9050df449e816e54b42","namedStarsArtifact":"shared/catalog/star-names.v1.json","namedStarsContentSha256":"3c19ad6ac3930ae71e7a72050528b441bbb86d40f3e902af543ee8f8afc7f731","constellationsArtifact":"shared/catalog/constellations.v1.json","constellationsContentSha256":"1bcf6f3b0ef12d769d7cd41ce1972a98b73c9dd8ca095318a9e8bf356b249e1a"},"stars":[[3,28,0.0232783289,-0.0996146671,4.61,1.04,"33 Psc","K0IIIbCN-0.5"],[15,358,0.0366010089,0.5077259757,2.06,-0.11,"21Alp And","B8IVpMnHg"],[21,432,0.0400480341,1.0323574044,2.27,0.34,"11Bet Cas","F2III-IV"],[25,496,0.0410661429,-0.7984444996,3.88,1.03,"Eps Phe","K0III"],[33,693,0.0491528351,-0.2699684983,4.89,0.49,"6 Cet","F7V"],[39,886,0.0577558538,0.2650040062,2.83,-0.23,"88Gam Peg","B2IV"],[45,1013,0.0637190621,0.3526728642,4.8,1.57,"89Chi Peg","M2+III"],[48,1038,0.0638790506,-0.3304393088,4.44,1.66,"7 Cet","M3III"],[63,1280,0.0745764645,0.6751224435,4.61,0.06,"24The And","A2V"],[68,1404,0.0799724408,0.6420242135,4.52,0.05,"25Sig And","A2V"],[74,1522,0.0847720962,-0.1540059139,3.56,1.22,"8Iot Cet","K1.5III"],[77,1581,0.0875791674,-1.1322775041,4.23,0.58,"Zet Tuc","F9V"],[98,2151,0.1123628428,-1.3483395692,2.8,0.62,"Bet Hyi","G2IV"],[99,2261,0.1146826763,-0.7383809326,2.39,1.09,"Alp Phe","K0III"],[100,2262,0.1143336104,-0.7623598173,3.94,0.17,"Kap Phe","A7V"],[105,2429,0.1218603428,-0.5760847047,4.81,1.64,"Eta Scl","M4III"],[123,2772,0.1386373203,0.9515922933,4.73,-0.1,"14Lam Cas","B8Vn"],[125,2834,0.1370810683,-0.8517837008,4.77,0.02,"Lam1Phe","A0V"],[126,2884,0.1376410281,-1.0988253601,4.37,-0.07,"Bet1Tuc","B9V"],[127,2885,0.137706478,-1.0989611079,4.54,0.15,"Bet2Tuc","A2V+A7V"],[130,2905,0.1439896633,1.0983647871,4.16,0.14,"15Kap Cas","B1Ia"],[153,3360,0.1613193283,0.9406791373,3.66,-0.2,"17Zet Cas","B2IV"],[154,3369,0.1609266292,0.5885153275,4.36,-0.14,"29Pi And","B5V"],[163,3546,0.1682279233,0.5115850926,4.37,0.87,"30Eps And","G6IIIFe-3CH1"],[165,3627,0.1716022265,0.5386231516,3.27,1.28,"31Del And","K3III"],[168,3712,0.1767509478,0.9867606777,2.23,1.17,"18Alp Cas","K0IIIa"],[179,3901,0.1835431875,0.8816094384,4.8,-0.11,"19Xi Cas","B2V"],[180,3919,0.1803216006,-0.8043349858,4.59,0.97,"Mu Phe","G8III"],[184,4058,0.1896663843,0.8207362326,4.94,0.18,"20Pi Cas","A5V"],[188,4128,0.1901972552,-0.3139265548,2.04,1.02,"16Bet Cet","G9.5IIICH-1"],[191,4150,0.1891646021,-1.0029195177,4.36,0,"Eta Phe","A0IV"],[193,4180,0.195149627,0.8427225331,4.54,-0.07,"22Omi Cas","B5IIIe"],[194,4188,0.1928152491,-0.1851697374,4.76,1.01,"17Phi1Cet","K0III"],[215,4502,0.2065524448,0.4235429281,4.06,1.12,"34Zet And","K1IIe"],[219,4614,0.2142391657,1.0090766515,3.44,0.57,"24Eta Cas","F9V+dM0"],[223,4636,0.2130828851,0.8895652309,4.89,-0.11,"25Nu Cas","B9III"],[224,4656,0.2124211144,0.1323832238,4.43,1.5,"63Del Psc","K4IIIb"],[226,4727,0.2173516695,0.7169618642,4.53,-0.15,"35Nu And","B5V+F8V"],[244,5015,0.2315542863,1.0668179609,4.82,0.53,null,"F8V"],[248,5112,0.2312924869,-0.0199694755,4.77,1.57,"20 Cet","M0III"],[253,5234,0.2399900444,1.0292691413,4.83,1.21,"26Ups1Cas","K2III"],[264,5394,0.2474367825,1.0597057442,2.47,-0.15,"27Gam Cas","B0IVe"],[265,5395,0.247240433,1.0329052439,4.63,0.96,"28Ups2Cas","G8IIIbFe-0.5"],[269,5448,0.247633132,0.6719420657,3.87,0.13,"37Mu And","A5V"],[271,5516,0.2496111719,0.4087124776,4.42,0.94,"38Eta And","G8IIIb"],[280,5737,0.2557198242,-0.5123850352,4.31,-0.16,"Alp Scl","B7IIIp"],[285,5848,0.2999566486,1.5054676833,4.25,1.21,null,"K2II-III"],[294,6186,0.2746421022,0.137706478,4.28,0.96,"71Eps Psc","K0III"],[322,6595,0.2883429368,-0.8153935858,3.31,0.89,"Bet Phe","G8III"],[334,6805,0.2992803335,-0.1777133029,3.45,1.16,"31Eta Cet","K1.5IIICN1Fe0.5"],[335,6811,0.3032655019,0.8245274756,4.25,-0.07,"42Phi And","B7Ve"],[337,6860,0.3042617941,0.6216959758,2.06,1.58,"43Bet And","M0+IIIa"],[338,6882,0.2983858522,-0.9642216897,3.92,-0.08,"Zet Phe","B6V+B9V"],[343,6961,0.310246819,0.9625442343,4.33,0.17,"33The Cas","A7V"],[351,7087,0.311773982,0.36712516,4.66,1.03,"84Chi Psc","G8.5III-IIIa"],[352,7106,0.3126757355,0.5251647238,4.51,1.09,"83Tau Psc","K0.5IIIb"],[360,7318,0.3217878086,0.4290649559,4.65,1.04,"85Phi Psc","K0III"],[370,7570,0.3280564495,-0.7946726491,4.96,0.58,"Nu Phe","F8V"],[377,7788,0.3306017214,-1.2021149149,4.86,0.47,"Kap Tuc","F6IV"],[382,7927,0.3494221885,1.0163343123,4.98,0.68,"34Phi Cas","F0Ia"],[383,7964,0.3467387447,0.4758494761,4.76,0.03,"90Ups Psc","A3V"],[390,8207,0.3592760265,0.7946290159,4.88,1.08,"46Xi And","K0-IIIb"],[399,8491,0.374954901,1.1890928194,4.74,1.05,"36Psi Cas","K0III"],[402,8512,0.3666209538,-0.1428261105,3.6,1.06,"45The Cet","K0III-IIIb"],[403,8538,0.3744458466,1.0513039231,2.68,0.13,"37Del Cas","A5III-IV"],[412,8705,0.3735877264,-0.2547986782,4.9,1.23,"46 Cet","K2.5IIIb"],[417,8799,0.3824743612,0.7924958357,4.83,0.42,"48Ome And","F5IV"],[424,8890,0.6624033566,1.5579536124,2.02,0.6,"1Alp UMi","F7:Ib-II"],[429,9053,0.3855650484,-0.7560475431,3.41,1.57,"Gam Phe","M0-IIIa"],[434,9138,0.3935062965,0.10723109,4.84,1.37,"98Mu Psc","K4III"],[437,9270,0.3991713443,0.2678353181,3.62,0.97,"99Eta Psc","G7IIIa"],[440,9362,0.3981605078,-0.8564815453,3.95,0.99,"Del Phe","K0III"],[442,9408,0.4098542138,1.0337924529,4.71,1,"39Chi Cas","G9IIIb"],[458,9826,0.4223551346,0.7226632731,4.09,0.54,"50Ups And","F8V"],[464,9927,0.4275765779,0.8487245264,3.57,1.28,"51 And","K3-III"],[469,10072,0.433496153,0.774683781,4.98,0.89,"52Chi And","G8III"],[472,10144,0.4263621196,-0.9989682862,0.46,-0.16,"Alp Eri","B3Vpe"],[477,10205,0.4388630404,0.708201281,4.94,-0.09,"53Tau And","B8III"],[483,10307,0.444128117,0.7437478201,4.95,0.62,null,"G1.5V"],[489,10380,0.4425791373,0.0957749427,4.44,1.36,"106Nu Psc","K3IIIbBa0.1"],[496,10516,0.4523020757,0.8846831572,4.07,-0.04,"Phi Per","B2Vep"],[500,10550,0.4482223685,-0.0644074975,4.99,1.38,null,"K3II-III"],[509,10700,0.4540837659,-0.2781618495,3.5,0.72,"52Tau Cet","G8V"],[510,10761,0.4598651691,0.1598333744,4.26,0.96,"110Omi Psc","G8III"],[531,11171,0.4781547652,-0.1865126713,4.67,0.33,"53Chi Cet","F3III"],[539,11353,0.4863359961,-0.1803797782,3.73,1.14,"55Zet Cet","K0IIIBa0.1"],[542,11415,0.4991423495,1.1112511347,3.38,-0.15,"45Eps Cas","B3III"],[544,11443,0.4934118517,0.5162490002,3.41,0.49,"2Alp Tri","F6IV"],[545,11503,0.4953680749,0.3367758236,4.83,null,"5Gam1Ari","B9V"],[546,11502,0.4953680749,0.3367370385,4.75,-0.04,"5Gam2Ari","A1pSi"],[548,11529,0.5061454831,1.1987842449,4.99,-0.1,"46Ome Cas","B8III"],[549,11559,0.495477158,0.0556323699,4.62,0.94,"111Xi Psc","K0III"],[553,11636,0.5002113636,0.3631690804,2.64,0.13,"6Bet Ari","A5V"],[555,11695,0.4958771293,-0.8081310769,4.41,1.59,"Psi Phe","M4III"],[565,11930,0.5090689096,-0.393169351,4.85,1.42,"56 Cet","K4III"],[566,11937,0.5059636779,-0.9007450344,3.7,0.85,"Chi Eri","G8IIIbCNIV"],[569,11973,0.5145594245,0.4118298296,4.79,0.28,"9Lam Ari","F0V"],[570,11977,0.5014985439,-1.1806667576,4.69,0.95,"Eta2Hyi","G8.5III"],[574,12055,0.5112360267,-0.8270242661,4.83,0.88,null,"G8III"],[575,12111,0.5321363445,1.2375596431,4.54,0.16,"48 Cas","A3IV"],[580,12216,0.5385867905,1.263991685,3.98,-0.01,"50 Cas","A2V"],[585,12274,0.5236205922,-0.3678766212,4,1.57,"59Ups Cet","M0III"],[591,12311,0.5182318881,-1.0745943723,2.86,0.28,"Alp Hyi","F0V"],[596,12447,0.5325290436,0.0482341131,4.33,0.03,"113Alp Psc","A0pSiSr"],[603,12533,0.5406157358,0.7387930242,2.26,1.37,"57Gam1And","K3-IIb"],[604,12534,0.5406666412,0.7388124168,4.84,0.03,"57Gam2And","B8V+A0V"],[612,12767,0.5431900965,-0.5113281413,4.69,-0.17,"Nu For","B9.5pSi"],[617,12929,0.5548983469,0.4094978757,2,1.15,"13Alp Ari","K2-IIICa-1"],[620,13041,0.5606361168,0.6607671104,4.82,0.12,"58 And","A5IV-V"],[622,13161,0.5652394227,0.6106422239,3,0.14,"4Bet Tri","A5III"],[623,13174,0.5647085517,0.4527335598,4.98,0.33,"14 Ari","F2III"],[642,13480,0.5775803549,0.5288880929,4.94,0.78,"6 Tri","G5III+F5V"],[643,13520,0.5812891796,0.771988217,4.83,1.48,"60 And","K3.5IIIBa0.5:"],[649,13611,0.5803219763,0.1544034612,4.37,0.89,"65Xi 1Cet","G6II-IIICN-2"],[660,13974,0.5980079794,0.5973243921,4.87,0.61,"8Del Tri","G0.5V"],[664,14055,0.5991497156,0.5907454704,4.01,0.02,"9Gam Tri","A1Vnn"],[674,14228,0.5956372405,-0.8990578828,3.56,-0.12,"Phi Eri","B8V-IV"],[681,14386,0.6080072615,-0.0519671785,3.04,1.42,"68Omi Cet","M7IIIe+Bep"],[699,14872,0.6354016586,0.8775273072,4.71,1.53,"65 And","K4+III"],[705,15008,0.6184937815,-1.1983333681,4.09,0.03,"Del Hyi","A3V"],[707,15089,0.6504260346,1.1763955491,4.52,0.12,"Iot Cas","A5pSr"],[708,15130,0.6368270108,-0.2145106613,4.89,-0.03,"72Rho Cet","B9.5Vn"],[718,15318,0.6464626827,0.1476548547,4.28,-0.06,"73Xi 2Cet","B9III"],[721,15371,0.6413430503,-0.8325899271,4.25,-0.14,"Kap Eri","B5IV"],[740,15798,0.6636032704,-0.2660705963,4.75,0.45,"76Sig Cet","F4IV"],[749,16046,0.6712754469,-0.4927500811,4.9,-0.05,"Ome For","B9.5V"],[754,16161,0.6801329929,0.0976220828,4.86,0.87,"78Nu Cet","G8III"],[779,16582,0.6958773172,0.0057353458,4.07,-0.22,"82Del Cet","B2IV"],[781,16620,0.696226383,-0.2072093673,4.84,0.45,"83Eps Cet","F5V+F6V"],[788,16739,0.7079419056,0.7015157003,4.91,0.59,"12 Per","F9V"],[789,16754,0.6972590362,-0.748600805,4.75,0.06,null,"A2V"],[794,16815,0.7010405829,-0.695